{
  "capsule_id": "cap-personal-profile-001",
  "subject_id": "operator-local-profile",
  "jurisdiction": "NZ",
  "sensitivity": "personal",
  "allowed_purposes": [
    "personal_memory",
    "coding_assistance",
    "inference"
  ],
  "denied_purposes": [
    "ad_training",
    "third_party_resale",
    "public_leaderboard"
  ],
  "resident_regions": [
    "NZ"
  ],
  "data_classes": [
    "personal",
    "preferences",
    "source_code",
    "runtime_logs"
  ],
  "retention_days": 7,
  "export_allowed": false,
  "training_allowed": false,
  "personal_detail_level": "pseudonymous",
  "consent_scopes": [
    "personal_memory",
    "coding_assistance"
  ],
  "data_subject_rights": [
    "access",
    "correction",
    "deletion_request",
    "processing_objection"
  ],
  "schema_context": "https://schema.org",
  "consent_record": "local-profile-consent-v0",
  "metadata": {
    "storage": "local_encrypted_profile_store",
    "prompt_rule": "summarise preferences without exposing raw personal notes"
  }
}
