{
  "capsule_id": "cap-nz-code-001",
  "subject_id": "abx-workspace",
  "jurisdiction": "NZ",
  "sensitivity": "restricted",
  "allowed_purposes": [
    "coding_assistance",
    "inference",
    "test_generation"
  ],
  "denied_purposes": [
    "ad_training",
    "third_party_resale"
  ],
  "resident_regions": [
    "NZ"
  ],
  "data_classes": [
    "source_code",
    "policy",
    "runtime_logs"
  ],
  "retention_days": 14,
  "export_allowed": false,
  "training_allowed": false,
  "schema_context": "https://schema.org",
  "consent_record": "local-operator-policy-v0"
}
